{
  "$schema": "https://json-schema.org/draft/2020-12/schema",
  "$id": "urn:swhap:schema:validation-report:v1",
  "title": "SWHAP validation report (v1)",
  "description": "Machine-readable report emitted by swhap-validate / check_swhap.sh. Status: FROZEN (W1 sign-off 2026-06-05). Prose contract: specs/validator-report.md (semantics: exit mapping, determinism, versioning); this schema governs shape. schema_version is the constant \"1\" for the entire v1.x line; additive (minor) evolution keeps the open content model, so consumers MUST be tolerant readers. Canonical serialization: UTF-8, LF, one trailing newline, 2-space indent, keys sorted byte-wise, findings sorted by id.",
  "type": "object",
  "required": ["schema_version", "tool", "run", "summary", "findings"],
  "properties": {
    "schema_version": {
      "description": "Major schema version. Constant \"1\" for every v1.x report; consumers route on this value only.",
      "const": "1"
    },
    "tool": { "$ref": "#/$defs/tool" },
    "run": { "$ref": "#/$defs/run" },
    "summary": { "$ref": "#/$defs/summary" },
    "findings": {
      "description": "All FAIL/WARN/INFO findings. Passing checks emit no finding (they are counted in summary.pass and listed in run.checks_run). MUST be sorted by id, ascending byte-wise.",
      "type": "array",
      "items": { "$ref": "#/$defs/finding" }
    },
    "error": { "$ref": "#/$defs/error" }
  },
  "$defs": {
    "tool": {
      "description": "Producer identification. Build-stable, never run-variant: part of the canonical (byte-comparable) output.",
      "type": "object",
      "required": ["name", "version"],
      "properties": {
        "name": { "const": "swhap-validate" },
        "version": { "type": "string", "minLength": 1 },
        "commit": {
          "description": "Git commit of the validator build, when built from a checkout.",
          "type": "string",
          "pattern": "^[0-9a-f]{7,64}$"
        }
      }
    },
    "run": {
      "description": "Run context. The run-variant field set is EXACTLY {timestamp, repo, invocation}: the only fields in the whole document allowed to carry wall-clock time or machine-/invocation-specific data (D4 determinism). Under --run-meta-stable these are absent and meta_stable is true; the M4 AI-on/off non-interference proof byte-compares such reports.",
      "type": "object",
      "required": ["profile", "gate", "checks_run", "checks_skipped"],
      "properties": {
        "timestamp": {
          "description": "Run wall-clock time, RFC 3339 UTC second precision with Z suffix. The only clock read in the report. Run-variant: absent under meta_stable.",
          "type": "string",
          "format": "date-time",
          "pattern": "^[0-9]{4}-[0-9]{2}-[0-9]{2}T[0-9]{2}:[0-9]{2}:[0-9]{2}Z$"
        },
        "meta_stable": {
          "description": "True iff emitted with --run-meta-stable (run-variant fields omitted).",
          "type": "boolean",
          "default": false
        },
        "profile": {
          "description": "Validation profile (validator plan section 4.2). legacy = D2/C3 read-only audit: findings keep true severities but are enforced:false, so the exit code is 0 unless the tool itself errs (exit 2/3/4).",
          "enum": ["strict-P", "strict-G", "legacy"]
        },
        "gate": {
          "description": "Gate context; in v1 only LG-1 is gate-sensitive (FAIL at publish, WARN at build). The publish step hard-requires exit 0 at gate=publish.",
          "enum": ["build", "publish"]
        },
        "strict_warn": {
          "description": "True iff --strict-warn was given (enforced WARN findings then force exit 1).",
          "type": "boolean",
          "default": false
        },
        "repo": {
          "description": "Repository path or URL as invoked. Run-variant: absent under meta_stable.",
          "type": "string",
          "minLength": 1
        },
        "head": {
          "description": "Commit hash examined (SHA-1 or SHA-256 repo). Content-derived, NOT run-variant: stays in canonical output (its equality across AI-on/off runs is itself non-interference evidence). Required in practice for exit-0/1 reports; may be absent in partial error reports.",
          "type": "string",
          "pattern": "^([0-9a-f]{40}|[0-9a-f]{64})$"
        },
        "refs_checked": {
          "description": "Fully-qualified refs examined, sorted byte-wise ascending.",
          "type": "array",
          "items": { "type": "string", "pattern": "^refs/" }
        },
        "invocation": {
          "description": "argv echo for audit trails. Run-variant: absent under meta_stable.",
          "type": "array",
          "items": { "type": "string" }
        },
        "intake_profile": {
          "description": "Set when --intake-profile was given (SZ-4 routing).",
          "enum": ["browser", "cli"]
        },
        "published_remote": {
          "description": "Remote name declared published (DV-1).",
          "type": "string"
        },
        "checks_run": {
          "description": "Every check ID executed, sorted byte-wise ascending. Load-bearing for the M4 proof: identical checks_run proves the same battery ran on both sides.",
          "type": "array",
          "items": { "$ref": "#/$defs/checkId" },
          "uniqueItems": true
        },
        "checks_skipped": {
          "description": "Checks not executed (--skip, profile/gate exclusion, or unavailability such as RB-1 without swhap-core) — skipped is always reported, never silent. Sorted by id. Reasons come from a fixed vocabulary: deterministic, no paths or timestamps.",
          "type": "array",
          "items": {
            "type": "object",
            "required": ["id", "reason"],
            "properties": {
              "id": { "$ref": "#/$defs/checkId" },
              "reason": { "type": "string", "minLength": 1 }
            }
          }
        }
      },
      "allOf": [
        {
          "if": {
            "properties": { "meta_stable": { "const": true } },
            "required": ["meta_stable"]
          },
          "then": {
            "description": "meta-stable mode: run-variant fields must be ABSENT (not null, not empty).",
            "properties": {
              "timestamp": false,
              "repo": false,
              "invocation": false
            }
          },
          "else": {
            "required": ["timestamp", "repo"]
          }
        }
      ]
    },
    "summary": {
      "description": "fail/warn/info count FINDINGS; pass counts EXECUTED CHECKS that emitted zero findings (mixed semantics, deliberate and frozen). exit_code MUST equal the process exit code (pre-D1 dual mode: each per-profile document carries its own profile's code; the process exits with the max).",
      "type": "object",
      "required": ["fail", "warn", "info", "pass", "exit_code"],
      "properties": {
        "fail": { "type": "integer", "minimum": 0 },
        "warn": { "type": "integer", "minimum": 0 },
        "info": { "type": "integer", "minimum": 0 },
        "pass": { "type": "integer", "minimum": 0 },
        "exit_code": {
          "description": "0 pass | 1 enforced FAIL (or enforced WARN under --strict-warn) | 2 usage/config error | 3 internal tool error | 4 precondition unmet (any PC-* FAIL; shallow clone is 4, not 2). Exact total mapping rule: prose contract section 4.1 (precedence 2 then 3 then 4 then 1 then 0; counts never matter; state never enters). Reports with 2/3/4 are non-certifying.",
          "enum": [0, 1, 2, 3, 4]
        }
      }
    },
    "finding": {
      "type": "object",
      "required": [
        "id",
        "check_id",
        "severity",
        "enforced",
        "object",
        "message_plain",
        "required_approver_role",
        "state"
      ],
      "properties": {
        "id": {
          "description": "Stable finding identifier: <check_id> + ':' + first 12 lowercase-hex chars of SHA-256 over the canonical JSON of the finding's SUBJECT (the registered subject-key projection of `object`, NOT the whole object — prose contract section 2.1). Durable across reruns over identical inputs AND across v1.x tool upgrades (adding non-subject object keys is minor and id-preserving; changing the subject-key set is a major event). Unique within a report (collision = internal error, exit 3). AI explain/ keys per-finding explanations by this id; intake task-lists key on it. The family prefix matches the relaxed checkId pattern so a vendored v1.0 schema still validates a v1.x finding from a new check family.",
          "type": "string",
          "pattern": "^[A-Z]{2,5}-[0-9]+[a-z]?:[0-9a-f]{12}$"
        },
        "check_id": { "$ref": "#/$defs/checkId" },
        "severity": {
          "description": "Intrinsic classification under the active profile+gate. CLOSED enum for the whole v1 line (the exit mapping quantifies over it). Never downgraded to express non-enforcement — that is `enforced`. Legacy profile keeps true severities (CM-2 stays FAIL-classified). Gate-dependent severity is legitimate (LG-1: FAIL at publish, WARN at build).",
          "enum": ["FAIL", "WARN", "INFO"]
        },
        "enforced": {
          "description": "Whether this finding participates in exit-code computation. Strict profiles: true. Legacy profile: false for every finding except PC-* — the truthful representation of report-only mode (severity tells the truth about the artifact, enforced about the run's posture, the exit code follows mechanically).",
          "type": "boolean"
        },
        "object": {
          "description": "Check-specific machine data. MUST be deterministic (no wall-clock, no absolute paths — repo-relative POSIX only, no hostnames/PIDs/durations). The registered subject-key subset uniquely identifies the finding's subject within its check and seeds the finding id; non-subject keys may be added in minor versions without re-keying. Common key names: tag, ref, path, row, field, expected, actual, size_bytes, threshold_bytes, item. EVERY string value derived from untrusted archive/CSV bytes MUST use the byte-safe encoding (prose section 2.5a): non-UTF-8 bytes and ALL control/ANSI bytes are rendered as \\xHH text, never emitted raw — applies to ANY check (CSV-2, CSV-6, BP-4...), not just PI-1. PERSONAL-DATA RULE (all checks, not only PI-1): no finding may place a literal personal email address in object/messages/remediation; it carries the redacted token {value_hmac12, domain_class, domain?} of prose section 2.5b.",
          "type": "object"
        },
        "message_plain": {
          "description": "Plain-language explanation. Audience tag: non-expert (Profile A) — x-audience: non-expert. Self-contained, no git/CLI knowledge assumed; texts reviewed by a real non-expert at M1b. Intake's Profile-A rendering uses only this field plus severity, required_approver_role, state, remediation. Subject to the byte-safe / control-char-free / personal-data rules (prose sections 2.5a/2.5b); markup-surface (markdown/HTML) escaping is the RENDERING CONSUMER's responsibility, not the producer's.",
          "x-audience": "non-expert",
          "type": "string",
          "minLength": 1
        },
        "message_technical": {
          "description": "Technical detail. Audience tag: expert (Profiles B/D, curators, CI logs) — x-audience: expert. Same byte-safe / control-char-free / personal-data rules as message_plain (prose sections 2.5a/2.5b).",
          "x-audience": "expert",
          "type": "string"
        },
        "required_approver_role": {
          "description": "Role that must approve/resolve this finding (crit-M11). OPEN enum across v1.x (a deeper M2 legal model extends it additively, e.g. data-protection-officer). The enum branch below is ADVISORY (the documented v1 values, kept as an annotation); the schema accepts ANY non-empty string so a vendored v1.0 schema still validates a v1.x report that introduces a new role. Consumers MUST treat an unrecognized value as the most restrictive known role (legal-curator). user-provided input never satisfies a legal-curator item (crit-M10).",
          "anyOf": [
            { "enum": ["none", "curator", "legal-curator"] },
            { "type": "string", "minLength": 1 }
          ]
        },
        "state": {
          "description": "Approval state — a DERIVED VIEW computed at run time from the journal ledger via the finding-state derivation function (prose contract section 2.8: the latest state-transition ledger entry whose details.machine == 'finding:'+id). The ledger is canonical; the report is never written back. `open` when no such entry exists (legacy repos, pre-M1c runs). OPEN enum across v1.x: the enum branch below is ADVISORY (documented v1 values); the schema accepts ANY non-empty string so a vendored v1.0 schema still validates. Consumers treat unknown values as open. state never feeds the exit-code computation (no approval-as-bypass); only checks that themselves read the ledger (LG-1) react to approvals.",
          "anyOf": [
            { "enum": ["open", "acknowledged", "curator-approved"] },
            { "type": "string", "minLength": 1 }
          ]
        },
        "provenance": {
          "description": "Provenance-state reference for the metadata item this finding is about. REQUIRED on LG-1 findings and on CSV-3 findings flagging inferred/defaulted dates; optional elsewhere.",
          "type": "object",
          "required": ["item", "state"],
          "properties": {
            "item": {
              "description": "Ledger item identifier.",
              "type": "string",
              "minLength": 1
            },
            "state": {
              "description": "Frozen M1b provenance vocabulary.",
              "enum": ["observed", "computed", "inferred", "user-provided", "curator-approved"]
            }
          }
        },
        "remediation": {
          "description": "Actionable next step, plain language (rendered to Profile A).",
          "type": "string"
        }
      }
    },
    "checkId": {
      "description": "Stable registry ID (validator plan section 2.4). Documented v1 families: PC preflight (FAIL => exit 4), TF tree fidelity, BP branch purity, CSV version-history contract, CM codemeta, SZ size/LFS, RB reproducibility, DV published divergence, JC journal coverage, LG legal gate, PI email lint. Letter suffix covers staged forms (JC-1a). ADDING A NEW CHECK FAMILY IS A MINOR EVENT: the pattern accepts any 2-5 uppercase-letter family prefix so a vendored v1.0 schema still validates a v1.x report from a later family (e.g. a M2 legal family LM-1). Renames/removals of an existing ID are major schema events; retired IDs are reserved forever; changed semantics means a new ID.",
      "type": "string",
      "pattern": "^[A-Z]{2,5}-[0-9]+[a-z]?$"
    },
    "error": {
      "description": "Present on best-effort reports for exit 2 (usage) or 3 (internal). Such reports are non-certifying.",
      "type": "object",
      "required": ["code", "message"],
      "properties": {
        "code": { "enum": ["usage", "internal"] },
        "message": { "type": "string", "minLength": 1 },
        "check_id": { "$ref": "#/$defs/checkId" }
      }
    }
  }
}
